{
  "id": "epic:Fortnite",
  "name": "Fortnite",
  "multiplayer": true,
  "achievements": {
    "source": "none"
  },
  "notes": "Fortnite no está en Steam, así que Atreus no tiene de dónde sacar una lista de logros, y Epic no publica el progreso de nadie sin iniciar sesión —una contraseña que Atreus no te va a pedir—. Su progresión, además, son pases y misiones de temporada: caducan, y no dejan un 100 % que perseguir. Se queda en la colección por las horas y las guías."
}
